      -----------------------------------------------------------      
     |                   =====================                   |     
     |                           x T B                           |     
     |                   =====================                   |     
     |                         S. Grimme                         |     
     |          Mulliken Center for Theoretical Chemistry        |     
     |                    University of Bonn                     |     
      -----------------------------------------------------------      

   * xtb version 6.7.1 (edcfbbe) compiled by 'runner@Mac-1756978095027.local' on 2025-09-04

   xtb is free software: you can redistribute it and/or modify it under
   the terms of the GNU Lesser General Public License as published by
   the Free Software Foundation, either version 3 of the License, or
   (at your option) any later version.
   
   xtb is distributed in the hope that it will be useful,
   but WITHOUT ANY WARRANTY; without even the implied warranty of
   MERCHANTABILITY or FITNESS FOR A PARTICULAR PURPOSE.  See the
   GNU Lesser General Public License for more details.
   
   Cite this work as:
   * C. Bannwarth, E. Caldeweyher, S. Ehlert, A. Hansen, P. Pracht,
     J. Seibert, S. Spicher, S. Grimme, WIREs Comput. Mol. Sci., 2020, 11,
     e01493. DOI: 10.1002/wcms.1493
   
   for GFN2-xTB:
   * C. Bannwarth, S. Ehlert and S. Grimme., J. Chem. Theory Comput., 2019,
     15, 1652-1671. DOI: 10.1021/acs.jctc.8b01176
   for GFN1-xTB:
   * S. Grimme, C. Bannwarth, P. Shushkov, J. Chem. Theory Comput., 2017,
     13, 1989-2009. DOI: 10.1021/acs.jctc.7b00118
   for GFN0-xTB:
   * P. Pracht, E. Caldeweyher, S. Ehlert, S. Grimme, ChemRxiv, 2019, preprint.
     DOI: 10.26434/chemrxiv.8326202.v1
   for GFN-FF:
   * S. Spicher and S. Grimme, Angew. Chem. Int. Ed., 2020, 59, 15665-15673.
     DOI: 10.1002/anie.202004239
   
   for ALPB and GBSA implicit solvation:
   * S. Ehlert, M. Stahn, S. Spicher, S. Grimme, J. Chem. Theory Comput.,
     2021, 17, 4250-4261. DOI: 10.1021/acs.jctc.1c00471
   
   for ddCOSMO and CPCM-X implicit solvation:
   * M. Stahn, S. Ehlert, S. Grimme, J. Phys. Chem. A,
     2023, XX, XXXX-XXXX. DOI: 10.1021/acs.jpca.3c04382
   
   for DFT-D4:
   * E. Caldeweyher, C. Bannwarth and S. Grimme, J. Chem. Phys., 2017,
     147, 034112. DOI: 10.1063/1.4993215
   * E. Caldeweyher, S. Ehlert, A. Hansen, H. Neugebauer, S. Spicher,
     C. Bannwarth and S. Grimme, J. Chem. Phys., 2019, 150, 154122.
     DOI: 10.1063/1.5090222
   * E. Caldeweyher, J.-M. Mewes, S. Ehlert and S. Grimme, Phys. Chem. Chem. Phys.
     2020, 22, 8499-8512. DOI: 10.1039/D0CP00502A
   
   for sTDA-xTB:
   * S. Grimme and C. Bannwarth, J. Chem. Phys., 2016, 145, 054103.
     DOI: 10.1063/1.4959605
   
   in the mass-spec context:
   * V. Asgeirsson, C. Bauer and S. Grimme, Chem. Sci., 2017, 8, 4879.
     DOI: 10.1039/c7sc00601b
   * J. Koopman and S. Grimme, ACS Omega 2019, 4, 12, 15120-15133.
     DOI: 10.1021/acsomega.9b02011
   
   for metadynamics refer to:
   * S. Grimme, J. Chem. Theory Comput., 2019, 155, 2847-2862
     DOI: 10.1021/acs.jctc.9b00143
   
   for SPH calculations refer to:
   * S. Spicher and S. Grimme, J. Chem. Theory Comput., 2021, 17, 1701-1714
     DOI: 10.1021/acs.jctc.0c01306
   
   for ONIOM refer to:
   * C. Plett, A. Katbashev, S. Ehlert, S. Grimme, M. Bursch,
     Phys. Chem. Chem. Phys., 2023, 25, 17860-17868. DOI: 10.1039/D3CP02178E
   
   for DIPRO refer to:
   * J. Kohn, N. Gildemeister, S. Grimme, D. Fazzi, A. Hansen,
     J. Chem. Phys., 2023, just accepted.
   
   for PTB refer to:
   * S. Grimme, M. Mueller, A. Hansen, J. Chem. Phys., 2023, 158, 124111.
     DOI: 10.1063/5.0137838
   
   with help from (in alphabetical order)
   P. Atkinson, C. Bannwarth, F. Bohle, G. Brandenburg, E. Caldeweyher
   M. Checinski, S. Dohm, S. Ehlert, S. Ehrlich, I. Gerasimov, C. Hölzer
   A. Katbashev, J. Kohn, J. Koopman, C. Lavigne, S. Lehtola, F. März, M. Müller,
   F. Musil, H. Neugebauer, J. Pisarek, C. Plett, P. Pracht, F. Pultar,
   J. Seibert, P. Shushkov, S. Spicher, M. Stahn, M. Steiner, T. Strunk,
   J. Stückrath, T. Rose, and J. Unsleber
   
 * started run on 2026/01/06 at 17:34:22.484     
   ID    Z sym.   atoms
    1    6 C      1-3, 5, 6
    2    8 O      4
    3    1 H      7-14

           -------------------------------------------------
          |                Calculation Setup                |
           -------------------------------------------------

          program call               : xtb xtb.xyz --uhf 4 --input xtb.inp
          coordinate file            : xtb.xyz
          omp threads                :                    10

########################################################################
[WARNING] Please study the warnings concerning your input carefully
-1- readin_getBoolValue: could not parse 'TRUE'
########################################################################

           -------------------------------------------------
          |                 G F N 2 - x T B                 |
           -------------------------------------------------

        Reference                      10.1021/acs.jctc.8b01176
      * Hamiltonian:
        H0-scaling (s, p, d)           1.850000    2.230000    2.230000
        zeta-weighting                 0.500000
      * Dispersion:
        s8                             2.700000
        a1                             0.520000
        a2                             5.000000
        s9                             5.000000
      * Repulsion:
        kExp                           1.500000    1.000000
        rExp                           1.000000
      * Coulomb:
        alpha                          2.000000
        third order                    shell-resolved
        anisotropic                    true
        a3                             3.000000
        a5                             4.000000
        cn-shift                       1.200000
        cn-exp                         4.000000
        max-rad                        5.000000


          ...................................................
          :                      SETUP                      :
          :.................................................:
          :  # basis functions                  32          :
          :  # atomic orbitals                  32          :
          :  # shells                           20          :
          :  # electrons                        34          :
          :  max. iterations                   250          :
          :  Hamiltonian                  GFN2-xTB          :
          :  restarted?                      false          :
          :  GBSA solvation                  false          :
          :  PC potential                    false          :
          :  electronic temp.          300.0000000     K    :
          :  accuracy                    1.0000000          :
          :  -> integral cutoff          0.2500000E+02      :
          :  -> integral neglect         0.1000000E-07      :
          :  -> SCF convergence          0.1000000E-05 Eh   :
          :  -> wf. convergence          0.1000000E-03 e    :
          :  Broyden damping             0.4000000          :
          :  net charge                          0          :
          :  unpaired electrons                  4          :
          ...................................................

 iter      E             dE          RMSdq      gap      omega  full diag
   1    -18.6605598 -0.186606E+02  0.318E+00    6.00       0.0  T
   2    -18.6800701 -0.195103E-01  0.177E+00    5.98       1.0  T
   3    -18.6773458  0.272436E-02  0.964E-01    6.14       1.0  T
   4    -18.6815893 -0.424354E-02  0.299E-01    6.10       1.0  T
   5    -18.6826736 -0.108431E-02  0.966E-02    6.08       1.0  T
   6    -18.6827162 -0.425829E-04  0.451E-02    6.09       1.0  T
   7    -18.6827171 -0.904679E-06  0.200E-02    6.08       1.3  T
   8    -18.6827205 -0.334468E-05  0.308E-03    6.09       8.7  T
   9    -18.6827205 -0.659669E-08  0.154E-03    6.09      17.3  T
  10    -18.6827205 -0.561762E-08  0.426E-04    6.09      62.8  T
  11    -18.6827205 -0.263270E-09  0.142E-04    6.09     188.4  T

   *** convergence criteria satisfied after 11 iterations ***

         #    Occupation            Energy/Eh            Energy/eV
      -------------------------------------------------------------
         1        2.0000           -0.6913955             -18.8138
       ...           ...                  ...                  ...
        13        2.0000           -0.4624743             -12.5846
        14        2.0000           -0.4568453             -12.4314
        15        2.0000           -0.4536159             -12.3435
        16        1.0000           -0.4327834             -11.7766
        17        1.0000           -0.3958594             -10.7719
        18        1.0000           -0.2741704              -7.4606
        19        1.0000           -0.1624735              -4.4211 (HOMO)
        20                          0.0611750               1.6647 (LUMO)
        21                          0.1055322               2.8717
        22                          0.1284552               3.4954
        23                          0.1317227               3.5844
        24                          0.1458094               3.9677
       ...                                ...                  ...
        32                          0.6410875              17.4449
      -------------------------------------------------------------
                  HL-Gap            0.2236485 Eh            6.0858 eV
             Fermi-level           -0.2469166 Eh           -6.7189 eV

 SCC (total)                   0 d,  0 h,  0 min,  0.010 sec
 SCC setup                      ...        0 min,  0.001 sec (  5.383%)
 Dispersion                     ...        0 min,  0.000 sec (  4.504%)
 classical contributions        ...        0 min,  0.000 sec (  0.483%)
 integral evaluation            ...        0 min,  0.000 sec (  3.706%)
 iterations                     ...        0 min,  0.008 sec ( 80.712%)
 molecular gradient             ...        0 min,  0.000 sec (  4.337%)
 printout                       ...        0 min,  0.000 sec (  0.816%)

         :::::::::::::::::::::::::::::::::::::::::::::::::::::
         ::                     SUMMARY                     ::
         :::::::::::::::::::::::::::::::::::::::::::::::::::::
         :: total energy             -18.425351879241 Eh    ::
         :: gradient norm              0.279728937596 Eh/a0 ::
         :: HOMO-LUMO gap              6.085785179178 eV    ::
         ::.................................................::
         :: SCC energy               -18.682714609518 Eh    ::
         :: -> isotropic ES            0.018863847624 Eh    ::
         :: -> anisotropic ES          0.001676564087 Eh    ::
         :: -> anisotropic XC          0.008384439266 Eh    ::
         :: -> dispersion             -0.007602517727 Eh    ::
         :: repulsion energy           0.257362730277 Eh    ::
         :: add. restraining           0.000000000000 Eh    ::
         :: total charge               0.000000000053 e     ::
         :::::::::::::::::::::::::::::::::::::::::::::::::::::

           -------------------------------------------------
          |                Property Printout                |
           -------------------------------------------------

    * Orbital Energies and Occupations

         #    Occupation            Energy/Eh            Energy/eV
      -------------------------------------------------------------
         1        2.0000           -0.6913955             -18.8138
       ...           ...                  ...                  ...
         7        2.0000           -0.5332960             -14.5117
         8        2.0000           -0.5324153             -14.4878
         9        2.0000           -0.5243174             -14.2674
        10        2.0000           -0.4967075             -13.5161
        11        2.0000           -0.4879066             -13.2766
        12        2.0000           -0.4815888             -13.1047
        13        2.0000           -0.4624743             -12.5846
        14        2.0000           -0.4568453             -12.4314
        15        2.0000           -0.4536159             -12.3435
        16        1.0000           -0.4327834             -11.7766
        17        1.0000           -0.3958594             -10.7719
        18        1.0000           -0.2741704              -7.4606
        19        1.0000           -0.1624735              -4.4211 (HOMO)
        20                          0.0611750               1.6647 (LUMO)
        21                          0.1055322               2.8717
        22                          0.1284552               3.4954
        23                          0.1317227               3.5844
        24                          0.1458094               3.9677
        25                          0.1465211               3.9870
        26                          0.1711951               4.6585
        27                          0.2237056               6.0873
        28                          0.2616578               7.1201
        29                          0.2694411               7.3319
        30                          0.3765120              10.2454
       ...                                ...                  ...
        32                          0.6410875              17.4449
      -------------------------------------------------------------
                  HL-Gap            0.2236485 Eh            6.0858 eV
             Fermi-level           -0.2469166 Eh           -6.7189 eV

     #   Z          covCN         q      C6AA      α(0)
     1   6 C        3.750    -0.098    22.434     6.755
     2   6 C        3.800    -0.026    21.044     6.532
     3   6 C        2.814     0.088    26.034     8.360
     4   8 O        0.858    -0.300    19.777     5.962
     5   6 C        2.886    -0.029    28.718     8.786
     6   6 C        2.834    -0.089    30.219     9.008
     7   1 H        0.924     0.049     2.330     2.387
     8   1 H        0.924     0.057     2.230     2.335
     9   1 H        0.924     0.057     2.230     2.335
    10   1 H        0.924     0.053     2.288     2.366
    11   1 H        0.924     0.053     2.288     2.366
    12   1 H        0.925     0.065     2.140     2.288
    13   1 H        0.925     0.054     2.267     2.355
    14   1 H        0.925     0.065     2.139     2.287

 Mol. C6AA /au·bohr⁶  :       1730.828378
 Mol. C8AA /au·bohr⁸  :      38857.363633
 Mol. α(0) /au        :         64.120234


Wiberg/Mayer (AO) data.
largest (>0.10) Wiberg bond orders for each atom

 ---------------------------------------------------------------------------
     #   Z sym  total        # sym  WBO       # sym  WBO       # sym  WBO
 ---------------------------------------------------------------------------
     1   6 C    3.993 --     2 C    1.027     8 H    0.979     9 H    0.979
                             7 H    0.968
     2   6 C    3.964 --     1 C    1.027    10 H    0.946    11 H    0.946
                             3 C    0.869     4 O    0.107
     3   6 C    3.364 --     4 O    1.582     2 C    0.869     5 C    0.837
     4   8 O    1.988 --     3 C    1.582     5 C    0.160     2 C    0.107
     5   6 C    3.074 --     6 C    1.041    12 H    0.952     3 C    0.837
                             4 O    0.160
     6   6 C    3.028 --     5 C    1.041    13 H    0.967    14 H    0.946
     7   1 H    0.997 --     1 C    0.968
     8   1 H    0.997 --     1 C    0.979
     9   1 H    0.997 --     1 C    0.979
    10   1 H    0.996 --     2 C    0.946
    11   1 H    0.996 --     2 C    0.946
    12   1 H    0.995 --     5 C    0.952
    13   1 H    0.997 --     6 C    0.967
    14   1 H    0.994 --     6 C    0.946
 ---------------------------------------------------------------------------

Topologies differ in total number of bonds
Writing topology from bond orders to xtbtopo.mol

molecular dipole:
                 x           y           z       tot (Debye)
 q only:        0.573       0.738      -0.582
   full:        0.690       0.823      -0.649       3.190
molecular quadrupole (traceless):
                xx          xy          yy          xz          yz          zz
 q only:        2.810      -3.713      -1.572       2.843       0.857      -1.237
  q+dip:        1.936      -4.974      -1.051       3.838       0.595      -0.885
   full:        2.193      -4.935      -1.286       3.808       1.009      -0.907


 cube file module (SG, 7/16)
 cube_pthr     :   0.050
 cube_step     :   0.400
 cube_boundoffset     :   3.000
 non-zero P (%):  14.394   nmat:      76
 Grid Boundaries (x y z) :
   9.2949422827681332        6.0643798836845058        5.7210544413634654     
  -7.6050169013038120       -6.5432175864020792       -5.6228264774056935     
 Total # of points       39904
 writing spindensity.cub
 N    (numint) :  3.771
cpu  time for cube    0.05 s
wall time for cube    0.05 s

 cube file module (SG, 7/16)
 cube_pthr     :   0.050
 cube_step     :   0.400
 cube_boundoffset     :   3.000
 non-zero P (%):  34.848   nmat:     184
 Grid Boundaries (x y z) :
   9.2949422827681332        6.0643798836845058        5.7210544413634654     
  -7.6050169013038120       -6.5432175864020792       -5.6228264774056935     
 Total # of points       39904
 writing density.cub
 N    (numint) : 22.909
cpu  time for cube    0.12 s
wall time for cube    0.11 s

           -------------------------------------------------
          | TOTAL ENERGY              -18.425351879241 Eh   |
          | GRADIENT NORM               0.279728937596 Eh/α |
          | HOMO-LUMO GAP               6.085785179178 eV   |
           -------------------------------------------------

------------------------------------------------------------------------
 * finished run on 2026/01/06 at 17:34:22.675     
------------------------------------------------------------------------
 total:
 * wall-time:     0 d,  0 h,  0 min,  0.190 sec
 *  cpu-time:     0 d,  0 h,  0 min,  0.196 sec
 * ratio c/w:     1.028 speedup
 SCF:
 * wall-time:     0 d,  0 h,  0 min,  0.010 sec
 *  cpu-time:     0 d,  0 h,  0 min,  0.023 sec
 * ratio c/w:     2.446 speedup

